{"schema_version":"1.0","characters":[{"id":"CHAR-PERFORMER","name":"Performer","canonical":{},"unknowns":[],"proposals":[]}],"locations":[],"props":[{"id":"PROP-HANDOFF","name":"Handoff prop","canonical":{"owner":"CHAR-PERFORMER"},"unknowns":[],"proposals":[]}],"scene_states":[{"scene_id":"SC001","characters":["CHAR-PERFORMER"],"locations":[],"props":["PROP-HANDOFF"],"entry":{"prop":"right hand"},"exit":{"prop":"right hand"},"source_revision":"v1"}]}
